clue,answer,source
Think shop needs rebuke (10),DELIBERATE,times_xwd_times
Serious attention retreat needed (7),EARNEST,times_xwd_times
"Female, commonly odious and critical (7)",FATEFUL,times_xwd_times
Disagreement on acceptance of a queen's duty (6),TARIFF,times_xwd_times
Effeminate chap writing about class work (7),MILKSOP,times_xwd_times
"Pray with heart not with head, returning thanks (7)",ENTREAT,times_xwd_times
Took on suitable editor without visit to see (7),ADOPTED,times_xwd_times
Worried if a host is an obsessive trendy! (11),FASHIONISTA,times_xwd_times
"Get cash for proper detached place, not large (7)",REALISE,times_xwd_times
Port city with area for university student residence (4),HALL,times_xwd_times
Charles's going to loudly show amusement (7),CHUCKLE,times_xwd_times
Flat behind the Spanish cardinal (6),ELEVEN,times_xwd_times
"Little time before long trip, missing start for early contest (7)",TOURNEY,times_xwd_times
Be getting on motorway over part of England to make fortune (9),MEGABUCKS,times_xwd_times
Standards concerning rector (6),PARSON,times_xwd_times
"Tricky problem, brewing artisan beer (5-6)",BRAIN-TEASER,times_xwd_times
Severe reduction in A & E (5),ACUTE,times_xwd_times
Building feature: walls in Nevada and Delaware (9),COLONNADE,times_xwd_times
"Piano music's silence, with nothing played fast (6)",PRESTO,times_xwd_times
Soft-hearted person posted current crew thanks and tip (14),SENTIMENTALIST,times_xwd_times
"Shrub, one beyond blight — job to contain it? (8)",TAMARISK,times_xwd_times
Love appearing in underwear in funny shows (6),PANTOS,times_xwd_times
Suggest work in writing (7),PROPOSE,times_xwd_times
Compound kept by some Westerners (5),ESTER,times_xwd_times
"Different people – not her sort, not all of them (6)",OTHERS,times_xwd_times
Beast that is cross — bull initially confined (4),IBEX,times_xwd_times
Cow perhaps having drink at home with insect (8),RUMINANT,times_xwd_times
"European, extremely old, stopping to become less hard occasionally (5,2,5)",EVERY SO OFTEN,times_xwd_times
Proverbial drinker outside pub is European (7),FINNISH,times_xwd_times
"Clandestine people see City sector in trouble (6,7)",SECRET SOCIETY,times_xwd_times
"Coffee, second of two, unfinished (5)",LATTE,times_xwd_times
"Having climbed moor? That is right, it’s more spacious (7)",ROOMIER,times_xwd_times
Certainly bachelor interrupts ruse for ladies’ man (7),PLAYBOY,times_xwd_times
Section of poem to preserve — Tasso’s no fool (5),CANTO,times_xwd_times
A doctor’s old reading desk (4),AMBO,times_xwd_times
"Police force, green, admire criminal (11)",GENDARMERIE,times_xwd_times
Swimming manager fills dry bag (9),TERMAGANT,times_xwd_times
Comic show needs help over name (8),COMEDIAN,times_xwd_times
Northern city quickly attracting any number (7),PRESTON,times_xwd_times
Total when innings complete? (3-3),ALL,times_xwd_times
"This won't turn in the lock (5,4)",CANAL BOAT,times_xwd_times
"Publication by students with classy, clean content, fantastic achievement (6,4)",MAGNUM OPUS,times_xwd_times
Confused pie chart and inscription (8),EPIGRAPH,times_xwd_times
Fool turned up in tank top (3),NIT,times_xwd_times
Insular type this writer maligns (8),ISLANDER,times_xwd_times
One sacked after university abandons resistance (7),UNIFIED,times_xwd_times
"Fail to win compassion, become disillusioned (4,5)",LOSE HEART,times_xwd_times
Back yard fencing weak and sagging (6),DROOPY,times_xwd_times
Robot starts to design rocket on its doorstep (5),DROID,times_xwd_times
Custom from American era (5),USAGE,times_xwd_times
Popular — till people will show resentment (11),INDIGNATION,times_xwd_times
"Doctor percussing a lot who will get you looking better (7,7)",PLASTIC SURGEON,times_xwd_times
Express dismay as relative has nothing to eat (5),GROAN,times_xwd_times
Concerned with component of blood containing iodine — that’s worrying (7),SERIOUS,times_xwd_times
Translation of Hardy located around one Arab city (6),RIYADH,times_xwd_times
One male voice giving nothing away (9),IMPASSIVE,times_xwd_times
Like one with a large landmass (4),ASIA,times_xwd_times
"Widow’s share some shrew, odd, recalled (5)",DOWER,times_xwd_times
"What might season reportedly be, after fuss? (7)",POTHERB,times_xwd_times
Clothing submerged in northern river? (9),UNDERWEAR,times_xwd_times
Cheats and criminals caught out (5),ROOKS,times_xwd_times
Nuclear accident in British base (8),BLOWDOWN,times_xwd_times
Mischievous child cuts leg off its first unit (6),PASCAL,times_xwd_times
Tag game outside involved tariff (8),GRAFFITO,times_xwd_times
"Reveal girth, bolting frenziedly (5,2,5)",BRING TO LIGHT,times_xwd_times
"Look, lad’s not finished garden feature (6)",GAZEBO,times_xwd_times
Grant a leader in the papers a column (8),CARYATID,times_xwd_times
"Reduce something bloody, having got back in time (8)",DEROGATE,times_xwd_times
Protective coat a Parisian youth put back round tongue? (9),UNDERSEAL,times_xwd_times
"Betrayed the trust of lecturer after treat misinterpreted (6,2)",RATTED ON,times_xwd_times
Hastily mend an old paving stone (6),COBBLE,times_xwd_times
Stupid angler almost hit pipe (8),NARGHILE,times_xwd_times
Failing to cross over desert (6),DEFECT,times_xwd_times
"He could be tough, lacking love? (4)",THUG,times_xwd_times
"Batting with more confidence, one offers chance to cover (7)",INSURER,times_xwd_times
"One living abroad has European vote, very conveniently (5)",EXPAT,times_xwd_times
Burned remains after emptying secret store (5),STASH,times_xwd_times
Acts badly after work at keyboard getting the same parts? (8),TYPECAST,times_xwd_times
"Palladium, introducing old character, cut back (6)",PRUNED,times_xwd_times
"Familiarly, wheels stick and make a harsh noise (6)",JAMJAR,times_xwd_times
Fool accepting second surprising plot development (5),TWIST,times_xwd_times
Graduate severe about one current leading teacher (9),MAHARISHI,times_xwd_times
Hydrogen expands in large flexible pipe (8),NARGHILE,times_xwd_times
Completely or nearly closed account (7),TOTALLY,times_xwd_times
Crustacean in pub clean when cooked (8),BARNACLE,times_xwd_times
Pictures came in for restoration (6),CINEMA,times_xwd_times
Doctor holding delicate fabric up still (6),BECALM,times_xwd_times
Rescue dog losing tail (8),RETRIEVE,times_xwd_times
"Raven’s cry, primarily croaky and whiny (3)",CAW,times_xwd_times
"In charge, one party of Africans ringed girl (7)",FIANCEE,times_xwd_times
Lug in that case of clay (7),EARTHEN,times_xwd_times
Record single up around number four in chart (5),ENROL,times_xwd_times
Municipal head from Irish county? Right (5),MAYOR,times_xwd_times
There’s a point to this law needing reform (3),AWL,times_xwd_times
"Strange being on underground with a railway minister (7,9)",FOREIGN SECRETARY,times_xwd_times
Girl in New York who looks after children? (5),NANNY,times_xwd_times
"One might be attached to a parcel, a tiny bit of land? (7,5)",POSTAGE STAMP,times_xwd_times
One admitted to being unstable? It’s still to be settled (9),LIABILITY,times_xwd_times
Looked at team getting embarrassed after trick (10),CONSIDERED,times_xwd_times
A missing Citroen car crashed? Wrong (9),INCORRECT,times_xwd_times
Back in a short while (6),SECOND,times_xwd_times
Perhaps metal from church roof in the van (4),LEAD,times_xwd_times
"Share the Sunday joint, do we hear? (4)",METE,times_xwd_times
Present of francs given to monarch (5),OFFER,times_xwd_times
"Please understand term gent now misused when feeding dog (4,3,2,5)",DONT GET ME WRONG,times_xwd_times
Part of deck on which 45 may go for a spin (9),TURNTABLE,times_xwd_times
"Fat tummy, big concern (11)",CORPORATION,times_xwd_times
Router sends digger round Bath (10),DISPATCHER,times_xwd_times
Asian dog covering miles (5),TAMIL,times_xwd_times
Nobleman upset Liberal? That's funny (5),DROLL,times_xwd_times
Greek party with wealth not half evident (5),DORIC,times_xwd_times
"Smooth style of progress through various gears? Nonsense (3,3,7)",GAS AND GAITERS,times_xwd_times
"Charmer, bachelor in art school, that might be handy in a street fight (11)",SWITCHBLADE,times_xwd_times
Construction of poem featuring in Eliot’s first gamble (7),EDIFICE,times_xwd_times
Mike’s stuffing piece of meat to munch with gusto (5),CHOMP,times_xwd_times
Argument inspector advanced in Home Counties (7),DISPUTE,times_xwd_times
"Fully discuss party no longer in the game (6,3)",THRASH OUT,times_xwd_times
Intrepid daughter missing parent's sister (9),DAUNTLESS,times_xwd_times
"Endlessly, the guard returned bringing sort of beer (7)",DRAUGHT,times_xwd_times
"Several faiths TV represented in a religious celebration (7,8)",HARVEST FESTIVAL,times_xwd_times
"Pub riot, with cokes spilled? It's young people's entertainment (7,5)",PICTURE BOOKS,times_xwd_times
"Ascending in medieval society, one worked hard (5)",SLAVE,times_xwd_times
"Hater of Brussels sprouts to start with mushroom, having obsessed about removing cap (11)",EUROSCEPTIC,times_xwd_times
"Like some surgeons in navy, retire unhappily (10)",VETERINARY,times_xwd_times
"Praise, primarily, to give the thing acclaim? (7)",PLAUDIT,times_xwd_times
Robert has been ahead in Olympic event (7),BOBSLED,times_xwd_times
Maxim’s garden feature? (5),GNOME,times_xwd_times
Plea to dine among competitors (8),ENTREATY,times_xwd_times
Made a meal of deliveries and declared (10),OVERSTATED,times_xwd_times
"Rich, fit and not working (4-3)",WELL,times_xwd_times
Sprite seen in hotel foyer (3),ELF,times_xwd_times
Amphibian originally eaten for tea (3),EFT,times_xwd_times
